{
  "id": "SC-101",
  "entity": "showcase",
  "env": "dev",
  "schema_version": "v1.0.0",
  "created_at": "2025-10-01T12:00:00Z",
  "updated_at": "2025-10-15T09:00:00Z",
  "title": "Harlem Nights Residency",
  "subtitle": "Four-weekend takeover with Nova Blue",
  "status": "Live",
  "listing_status": "Live",
  "start_at": "2025-12-06T02:00:00Z",
  "end_at": "2025-12-06T05:00:00Z",
  "timezone": "America/New_York",
  "venue": {
    "name": "Uptown Theater",
    "slug": "uptown-theater",
    "city": "New York",
    "state": "NY",
    "country": "USA",
    "capacity": 1200
  },
  "performers": [
    { "name": "Nova Blue", "role": "Headliner", "genre": "R&B", "slug": "nova-blue", "is_headliner": true },
    { "name": "DJ Helix", "role": "Support", "genre": "House" }
  ],
  "capacity": { "total": 1200, "available": 320, "sold": 800, "holds": 80 },
  "tickets": {
    "url": "https://tickets.example.com/harlem-nights",
    "currency": "USD",
    "min_price": 45,
    "max_price": 125,
    "fees": { "service": 6.5, "processing": 2.5 }
  },
  "booking_window": {
    "opens_at": "2025-10-15T12:00:00Z",
    "closes_at": "2025-12-05T23:00:00Z"
  },
  "feature_priority": 1,
  "commercial_terms": { "rev_share_pct": 20, "flat_fee_usd": 5000 },
  "verification": { "badge": "Verified Host", "last_audited_at": "2025-09-30T12:00:00Z" },
  "availability": { "holds_expire_at": "2025-12-03T00:00:00Z", "crew_confirmed": true },
  "tags": ["residency", "soul", "supper-club"],
  "assets": {
    "poster_url": "https://assets.example.com/showcases/sc-101/poster.jpg",
    "stage_plot_url": "https://assets.example.com/showcases/sc-101/stage-plot.pdf"
  }
}
